{
  "format": "argus.inventory",
  "schemaVersion": 1,
  "seller": {
    "id": "11111111-1111-4111-8111-111111111111",
    "name": "Тестовая компания"
  },
  "warehouse": {
    "id": "22222222-2222-4222-8222-222222222222"
  },
  "quantityMode": "absolute",
  "missingItems": "unchanged",
  "primaryMeasure": "available",
  "items": [
    {
      "sku": "TEST-001",
      "barcode": "0000123456789",
      "name": "Тестовый товар — не рабочие данные",
      "unit": "pcs",
      "onHand": 100,
      "inAssembly": 30,
      "available": 70,
      "stockObservedAt": "2026-09-10T10:00:00.000Z"
    }
  ],
  "snapshotId": "250fe668cd0e1a3281b394536bfbcff3858e666ea4bd8e9a448ba0b865e193bd",
  "generatedAt": "2026-09-10T10:05:00Z"
}
